{
  "schema_version": 1,
  "catalog_id": "hot.shared_assets",
  "catalog_version": 5,
  "assets": [
    {
      "id": "root/universal_handle",
      "aliases": [
        "handle_head/universal_handle"
      ],
      "role": "fixed_root",
      "searchable": false,
      "tags": [
        "root",
        "handle",
        "fixed"
      ],
      "resources": {
        "mesh": {
          "path": "assets/library/meshes/universal_handle.obj"
        },
        "cage": {
          "path": "assets/library/cages/universal_handle.txt"
        },
        "contacts": {
          "path": "assets/library/contacts/universal_handle.txt"
        },
        "contact_ids": {
          "path": "assets/library/contacts/universal_handle_id.npy"
        },
        "weights": {
          "path": "assets/library/weights/universal_handle.npy"
        }
      },
      "out_docks": {
        "0": [
          {
            "id": 0,
            "barycentric": [
              0.5,
              0.5,
              0.0,
              0.0
            ]
          }
        ],
        "1": [
          {
            "id": 0,
            "barycentric": [
              0.5,
              0.0,
              0.0,
              0.5
            ]
          }
        ],
        "3": [
          {
            "id": 0,
            "barycentric": [
              0.5,
              0.0,
              0.0,
              0.5
            ]
          }
        ],
        "4": [
          {
            "id": 0,
            "barycentric": [
              0.5,
              0.5,
              0.0,
              0.0
            ]
          }
        ],
        "5": [
          {
            "id": 0,
            "barycentric": [
              0.25,
              0.25,
              0.25,
              0.25
            ]
          }
        ]
      },
      "in_docks": {},
      "metadata": {
        "blocked_face": 2,
        "grip_frame": "geometric_center",
        "specification": {
          "generator_version": 1,
          "geometry": {
            "shape": "faceted_cylinder",
            "canonical_axis": [
              0.0,
              1.0,
              0.0
            ],
            "length": 8.0,
            "radius": 0.45,
            "half_extents": [
              0.45,
              4.0,
              0.45
            ],
            "radial_segments": 16,
            "axial_segments": 8,
            "vertex_count": 146,
            "face_count": 288
          },
          "dynamics": {
            "mass": 1.0,
            "inertia": [
              5.383958333333333,
              0.10125,
              5.383958333333333
            ],
            "inertia_model": "solid_cylinder_about_center"
          },
          "interfaces": {
            "positive_end": {
              "position": [
                0.0,
                4.0,
                0.0
              ],
              "normal": [
                0.0,
                1.0,
                0.0
              ]
            },
            "negative_end": {
              "position": [
                0.0,
                -4.0,
                0.0
              ],
              "normal": [
                0.0,
                -1.0,
                0.0
              ]
            }
          },
          "collision_policy": {
            "upper_structure_collision": true,
            "default_task_physics_collision": false
          },
          "contact_count": 96,
          "weights_shape": [
            56,
            146
          ]
        }
      }
    },
    {
      "id": "primitive/cube",
      "aliases": [
        "sweep_balls/cube"
      ],
      "role": "head_primitive",
      "searchable": true,
      "tags": [
        "head",
        "primitive",
        "connector"
      ],
      "resources": {
        "mesh": {
          "path": "assets/library/meshes/cube.obj"
        },
        "cage": {
          "path": "assets/library/cages/cube.txt"
        },
        "contacts": {
          "path": "assets/library/contacts/cube.txt"
        },
        "contact_ids": {
          "path": "assets/library/contacts/cube_id.npy"
        },
        "weights": {
          "path": "assets/library/weights/cube.npy"
        }
      },
      "out_docks": {
        "1": [
          {
            "id": 0,
            "barycentric": [
              0.25,
              0.25,
              0.25,
              0.25
            ]
          },
          {
            "id": 1,
            "barycentric": [
              0.08333333333333337,
              0.08333333333333337,
              0.41666666666666663,
              0.41666666666666663
            ]
          },
          {
            "id": 2,
            "barycentric": [
              0.41666666666666663,
              0.41666666666666663,
              0.08333333333333334,
              0.08333333333333334
            ]
          },
          {
            "id": 3,
            "barycentric": [
              0.41666666666666663,
              0.08333333333333334,
              0.08333333333333334,
              0.41666666666666663
            ]
          },
          {
            "id": 4,
            "barycentric": [
              0.08333333333333337,
              0.41666666666666663,
              0.41666666666666663,
              0.08333333333333337
            ]
          }
        ],
        "2": [
          {
            "id": 0,
            "barycentric": [
              0.25,
              0.25,
              0.25,
              0.25
            ]
          },
          {
            "id": 1,
            "barycentric": [
              0.08333333333333337,
              0.08333333333333337,
              0.41666666666666663,
              0.41666666666666663
            ]
          },
          {
            "id": 2,
            "barycentric": [
              0.41666666666666663,
              0.41666666666666663,
              0.08333333333333334,
              0.08333333333333334
            ]
          },
          {
            "id": 3,
            "barycentric": [
              0.41666666666666663,
              0.08333333333333334,
              0.08333333333333334,
              0.41666666666666663
            ]
          },
          {
            "id": 4,
            "barycentric": [
              0.08333333333333337,
              0.41666666666666663,
              0.41666666666666663,
              0.08333333333333337
            ]
          }
        ],
        "3": [
          {
            "id": 0,
            "barycentric": [
              0.25,
              0.25,
              0.25,
              0.25
            ]
          },
          {
            "id": 1,
            "barycentric": [
              0.08333333333333337,
              0.08333333333333337,
              0.41666666666666663,
              0.41666666666666663
            ]
          },
          {
            "id": 2,
            "barycentric": [
              0.41666666666666663,
              0.41666666666666663,
              0.08333333333333334,
              0.08333333333333334
            ]
          },
          {
            "id": 3,
            "barycentric": [
              0.41666666666666663,
              0.08333333333333334,
              0.08333333333333334,
              0.41666666666666663
            ]
          },
          {
            "id": 4,
            "barycentric": [
              0.08333333333333337,
              0.41666666666666663,
              0.41666666666666663,
              0.08333333333333337
            ]
          }
        ],
        "4": [
          {
            "id": 0,
            "barycentric": [
              0.25,
              0.25,
              0.25,
              0.25
            ]
          },
          {
            "id": 1,
            "barycentric": [
              0.08333333333333337,
              0.08333333333333337,
              0.41666666666666663,
              0.41666666666666663
            ]
          },
          {
            "id": 2,
            "barycentric": [
              0.41666666666666663,
              0.41666666666666663,
              0.08333333333333334,
              0.08333333333333334
            ]
          },
          {
            "id": 3,
            "barycentric": [
              0.41666666666666663,
              0.08333333333333334,
              0.08333333333333334,
              0.41666666666666663
            ]
          },
          {
            "id": 4,
            "barycentric": [
              0.08333333333333337,
              0.41666666666666663,
              0.41666666666666663,
              0.08333333333333337
            ]
          }
        ],
        "5": [
          {
            "id": 0,
            "barycentric": [
              0.25,
              0.25,
              0.25,
              0.25
            ]
          },
          {
            "id": 1,
            "barycentric": [
              0.08333333333333337,
              0.08333333333333337,
              0.41666666666666663,
              0.41666666666666663
            ]
          },
          {
            "id": 2,
            "barycentric": [
              0.41666666666666663,
              0.41666666666666663,
              0.08333333333333334,
              0.08333333333333334
            ]
          },
          {
            "id": 3,
            "barycentric": [
              0.41666666666666663,
              0.08333333333333334,
              0.08333333333333334,
              0.41666666666666663
            ]
          },
          {
            "id": 4,
            "barycentric": [
              0.08333333333333337,
              0.41666666666666663,
              0.41666666666666663,
              0.08333333333333337
            ]
          }
        ]
      },
      "in_docks": {
        "0": [
          {
            "id": 0,
            "barycentric": [
              0.25,
              0.25,
              0.25,
              0.25
            ],